{
 "schema_version": "1.0",
 "rfam_acc": "RF00059",
 "seq_name": "7tzr_1_Y_B",
 "pdb_id": "7tzr",
 "entity_id": 1,
 "label_asym_id": "B",
 "auth_asym_id": "Y",
 "mapping_file": "mappings/7tzr_1_Y_B.json",
 "sources": {
  "reference_structural_elements": {
   "status": "unavailable",
   "detail": "not_available",
   "url": "https://rna.bgsu.edu/correspondence/nucleotide_annotation?chain=7TZR%7C1%7CY",
   "retrieved": "2026-10-17",
   "reference": "None|1|None",
   "note": "labels transferred by BGSU from the reference chain; for highlighting only"
  },
  "motif_atlas_loops": {
   "status": "evaluated",
   "url": "https://rna.bgsu.edu/rna3dhub/loops/download/7TZR",
   "motifs_url": "https://rna.bgsu.edu/rna3dhub/pdb/7TZR/motifs",
   "retrieved": "2026-10-17",
   "n_loops_involving_chain": 7,
   "motif_atlas_release": {
    "HL": "4.15",
    "IL": "4.15",
    "J3": "4.15",
    "J4": "4.15"
   }
  },
  "pdbe_binding_sites": {
   "status": "evaluated",
   "url": "https://www.ebi.ac.uk/pdbe/api/v2/pdb/entry/binding_sites/7tzr/1",
   "retrieved": "2026-10-17",
   "observation_level": "entity",
   "n_entity_chains": 2,
   "chain_attribution": "unresolved"
  }
 },
 "loops": [
  {
   "loop_id": "HL_7TZR_003",
   "loop_type": "HL",
   "motif_group": "HL_56046.1",
   "annotation_text": null,
   "atlas_status": "valid",
   "multi_chain": false,
   "chains": [
    "Y"
   ],
   "consensus_positions": [
    23,
    24,
    25,
    26
   ]
  },
  {
   "loop_id": "HL_7TZR_004",
   "loop_type": "HL",
   "motif_group": "HL_67772.4",
   "annotation_text": "T-loop related",
   "atlas_status": "valid",
   "multi_chain": false,
   "chains": [
    "Y"
   ],
   "consensus_positions": [
    70,
    71,
    72,
    73,
    74,
    75,
    76,
    77
   ]
  },
  {
   "loop_id": "IL_7TZR_005",
   "loop_type": "IL",
   "motif_group": null,
   "annotation_text": "Isolated non-canonical cWW pair",
   "atlas_status": "problematic",
   "multi_chain": false,
   "chains": [
    "Y"
   ],
   "consensus_positions": [
    14,
    15,
    16,
    49,
    51,
    52
   ]
  },
  {
   "loop_id": "IL_7TZR_006",
   "loop_type": "IL",
   "motif_group": "IL_38394.1",
   "annotation_text": "Stack outside cWW",
   "atlas_status": "valid",
   "multi_chain": false,
   "chains": [
    "Y"
   ],
   "consensus_positions": [
    16,
    17,
    31,
    32,
    33,
    34,
    35,
    36,
    37,
    49
   ]
  },
  {
   "loop_id": "IL_7TZR_007",
   "loop_type": "IL",
   "motif_group": "IL_37129.1",
   "annotation_text": "Minor groove platform related",
   "atlas_status": "valid",
   "multi_chain": false,
   "chains": [
    "Y"
   ],
   "consensus_positions": [
    19,
    20,
    21,
    28,
    29
   ]
  },
  {
   "loop_id": "IL_7TZR_008",
   "loop_type": "IL",
   "motif_group": null,
   "annotation_text": null,
   "atlas_status": "valid",
   "multi_chain": false,
   "chains": [
    "Y"
   ],
   "consensus_positions": [
    63,
    64,
    65,
    66,
    67,
    80,
    81,
    82,
    83,
    84
   ]
  },
  {
   "loop_id": "J3_7TZR_002",
   "loop_type": "J3",
   "motif_group": null,
   "annotation_text": null,
   "atlas_status": "problematic",
   "multi_chain": false,
   "chains": [
    "Y"
   ],
   "consensus_positions": [
    10,
    11,
    55,
    56,
    57,
    60,
    61,
    86,
    87,
    88,
    89
   ]
  }
 ],
 "bound_molecules": [
  {
   "ccd_id": "KWU",
   "name": "N-methyl-1-(quinoxalin-6-yl)methanamine",
   "ligand_class": "ligand",
   "bound_molecule_ids": [
    "bm1",
    "bm5"
   ],
   "attribution": "entity_unresolved",
   "is_best_chain": false,
   "in_default_track": true,
   "flags": [],
   "consensus_positions": [
    15,
    32,
    33,
    35,
    36,
    78
   ]
  },
  {
   "ccd_id": "K",
   "name": "POTASSIUM ION",
   "ligand_class": "metal_ion",
   "bound_molecule_ids": [
    "bm3"
   ],
   "attribution": "entity_unresolved",
   "is_best_chain": false,
   "in_default_track": false,
   "flags": [],
   "consensus_positions": [
    17,
    18,
    36,
    75,
    76,
    77
   ]
  },
  {
   "ccd_id": "MG",
   "name": "MAGNESIUM ION",
   "ligand_class": "metal_ion",
   "bound_molecule_ids": [
    "bm2"
   ],
   "attribution": "entity_unresolved",
   "is_best_chain": false,
   "in_default_track": false,
   "flags": [],
   "consensus_positions": [
    63,
    76,
    82
   ]
  }
 ],
 "residues": [
  {
   "label_seq_id": 1,
   "author_residue_number": 10,
   "author_insertion_code": "",
   "residue_name": "GTP",
   "alignment_state": "match",
   "rfam_consensus_pos": 6,
   "insertion_anchor": null,
   "pp_char": "*",
   "has_coordinates": true,
   "reference_element": null,
   "reference_element_unit_id": null,
   "loops": [],
   "bound_molecules": []
  },
  {
   "label_seq_id": 2,
   "author_residue_number": 11,
   "author_insertion_code": "",
   "residue_name": "G",
   "alignment_state": "match",
   "rfam_consensus_pos": 7,
   "insertion_anchor": null,
   "pp_char": "*",
   "has_coordinates": true,
   "reference_element": null,
   "reference_element_unit_id": null,
   "loops": [],
   "bound_molecules": []
  },
  {
   "label_seq_id": 3,
   "author_residue_number": 12,
   "author_insertion_code": "",
   "residue_name": "A",
   "alignment_state": "match",
   "rfam_consensus_pos": 8,
   "insertion_anchor": null,
   "pp_char": "*",
   "has_coordinates": true,
   "reference_element": null,
   "reference_element_unit_id": null,
   "loops": [],
   "bound_molecules": []
  },
  {
   "label_seq_id": 4,
   "author_residue_number": 13,
   "author_insertion_code": "",
   "residue_name": "C",
   "alignment_state": "match",
   "rfam_consensus_pos": 9,
   "insertion_anchor": null,
   "pp_char": "*",
   "has_coordinates": true,
   "reference_element": null,
   "reference_element_unit_id": null,
   "loops": [],
   "bound_molecules": []
  },
  {
   "label_seq_id": 5,
   "author_residue_number": 14,
   "author_insertion_code": "",
   "residue_name": "U",
   "alignment_state": "match",
   "rfam_consensus_pos": 10,
   "insertion_anchor": null,
   "pp_char": "*",
   "has_coordinates": true,
   "reference_element": null,
   "reference_element_unit_id": null,
   "loops": [
    {
     "loop_id": "J3_7TZR_002",
     "loop_type": "J3",
     "motif_group": null,
     "atlas_status": "problematic"
    }
   ],
   "bound_molecules": []
  },
  {
   "label_seq_id": 6,
   "author_residue_number": 15,
   "author_insertion_code": "",
   "residue_name": "C",
   "alignment_state": "match",
   "rfam_consensus_pos": 11,
   "insertion_anchor": null,
   "pp_char": "*",
   "has_coordinates": true,
   "reference_element": null,
   "reference_element_unit_id": null,
   "loops": [
    {
     "loop_id": "J3_7TZR_002",
     "loop_type": "J3",
     "motif_group": null,
     "atlas_status": "problematic"
    }
   ],
   "bound_molecules": []
  },
  {
   "label_seq_id": 7,
   "author_residue_number": 16,
   "author_insertion_code": "",
   "residue_name": "G",
   "alignment_state": "match",
   "rfam_consensus_pos": 12,
   "insertion_anchor": null,
   "pp_char": "*",
   "has_coordinates": true,
   "reference_element": null,
   "reference_element_unit_id": null,
   "loops": [],
   "bound_molecules": []
  },
  {
   "label_seq_id": 8,
   "author_residue_number": 17,
   "author_insertion_code": "",
   "residue_name": "G",
   "alignment_state": "match",
   "rfam_consensus_pos": 13,
   "insertion_anchor": null,
   "pp_char": "*",
   "has_coordinates": true,
   "reference_element": null,
   "reference_element_unit_id": null,
   "loops": [],
   "bound_molecules": []
  },
  {
   "label_seq_id": 9,
   "author_residue_number": 18,
   "author_insertion_code": "",
   "residue_name": "G",
   "alignment_state": "match",
   "rfam_consensus_pos": 14,
   "insertion_anchor": null,
   "pp_char": "*",
   "has_coordinates": true,
   "reference_element": null,
   "reference_element_unit_id": null,
   "loops": [
    {
     "loop_id": "IL_7TZR_005",
     "loop_type": "IL",
     "motif_group": null,
     "atlas_status": "problematic"
    }
   ],
   "bound_molecules": []
  },
  {
   "label_seq_id": 10,
   "author_residue_number": 19,
   "author_insertion_code": "",
   "residue_name": "G",
   "alignment_state": "match",
   "rfam_consensus_pos": 15,
   "insertion_anchor": null,
   "pp_char": "*",
   "has_coordinates": true,
   "reference_element": null,
   "reference_element_unit_id": null,
   "loops": [
    {
     "loop_id": "IL_7TZR_005",
     "loop_type": "IL",
     "motif_group": null,
     "atlas_status": "problematic"
    }
   ],
   "bound_molecules": [
    {
     "ccd_id": "KWU",
     "ligand_class": "ligand",
     "bound_molecule_ids": [
      "bm1",
      "bm5"
     ],
     "attribution": "entity_unresolved",
     "is_best_chain": false,
     "in_default_track": true,
     "flags": []
    }
   ]
  },
  {
   "label_seq_id": 11,
   "author_residue_number": 20,
   "author_insertion_code": "",
   "residue_name": "U",
   "alignment_state": "match",
   "rfam_consensus_pos": 16,
   "insertion_anchor": null,
   "pp_char": "*",
   "has_coordinates": true,
   "reference_element": null,
   "reference_element_unit_id": null,
   "loops": [
    {
     "loop_id": "IL_7TZR_005",
     "loop_type": "IL",
     "motif_group": null,
     "atlas_status": "problematic"
    },
    {
     "loop_id": "IL_7TZR_006",
     "loop_type": "IL",
     "motif_group": "IL_38394.1",
     "atlas_status": "valid"
    }
   ],
   "bound_molecules": []
  },
  {
   "label_seq_id": 12,
   "author_residue_number": 21,
   "author_insertion_code": "",
   "residue_name": "G",
   "alignment_state": "match",
   "rfam_consensus_pos": 17,
   "insertion_anchor": null,
   "pp_char": "*",
   "has_coordinates": true,
   "reference_element": null,
   "reference_element_unit_id": null,
   "loops": [
    {
     "loop_id": "IL_7TZR_006",
     "loop_type": "IL",
     "motif_group": "IL_38394.1",
     "atlas_status": "valid"
    }
   ],
   "bound_molecules": [
    {
     "ccd_id": "K",
     "ligand_class": "metal_ion",
     "bound_molecule_ids": [
      "bm3"
     ],